<?xml version="1.0" encoding="UTF-8"?>
<!ELEMENT questions (question+)>
<!ELEMENT question (type,sentence,option*,answer*)>
<!ATTLIST question id ID #REQUIRED>
<!ELEMENT type (#PCDATA)>
<!ELEMENT sentence (#PCDATA)>
<!ELEMENT option (#PCDATA)>
<!ELEMENT answer (#PCDATA)>